{
  "schema_version": "outcome-execution-attempt-observation.v1", "workflow_id": "outcome:CASE_004:1", "case_id": "CASE_004", "observation_id": "OBS_001", "observation_hash": "1515151515151515151515151515151515151515151515151515151515151515", "operation_id": "OP_004", "operation_key_hash": "1616161616161616161616161616161616161616161616161616161616161616",
  "request_hash": "1717171717171717171717171717171717171717171717171717171717171717", "external_idempotency_key_hash": "1818181818181818181818181818181818181818181818181818181818181818", "attempt_no": 1, "operation_sequence": 1, "required_for_closure": true, "compensable": true,
  "status": "AMBIGUOUS", "external_effect_truth": "UNKNOWN", "operation_status": "RECONCILING", "possible_dispatch_at": "2026-07-24T08:07:00Z", "observed_at": "2026-07-24T08:07:30Z", "epoch": 1, "source_revision": 13, "revision": 14, "fence": 6, "committed_event_sequence": 4,
  "closure_blocked": true, "blind_retry_blocked": true, "compensation_blocked": true
}
